Regiao - Sigla,Estado - Sigla,Municipio,Revenda,CNPJ da Revenda,Nome da Rua,Numero Rua,Complemento,Bairro,Cep,Produto,Data da Coleta,Valor de Venda,Valor de Compra,Unidade de Medida,Bandeira,Endereco completo,Latitude,Longitude;;;
"NE,RN,NATAL,JOAO HENRIQUE GODEIRO,08.195.919/0001-90,AVENIDA DR JOAO MEDEIRO FILHO,6181,,PAJUSSARA,59122-770,GASOLINA,28/04/2026,6.49,,R$ / litro,BRANCA,""AVENIDA DR JOAO MEDEIRO FILHO,6181,PAJUSSARA,NATAL,RN,BRAZIL"",-5.7448676,-35.2207712";;;
"NE,RN,NATAL,M. B. COM. E DERIVADOS DE PETROLEO EIRELI,08.345.698/0001-99,RUA JAGUARARI,4227,,CANDELARIA,59064-500,GASOLINA,27/04/2026,6.69,,R$ / litro,VIBRA,""RUA JAGUARARI,4227,CANDELARIA,NATAL,RN,BRAZIL"",-5.8317222,-35.2227703";;;
"NE,RN,NATAL,POSTO FREI DAMIAO LTDA,08.547.432/0006-33,AVENIDA CAPITAO MOR GOUVEIA,1807,,NOSSA SENHORA DE NAZARE,59060-400,GASOLINA,27/04/2026,6.79,,R$ / litro,VIBRA,""AVENIDA CAPITAO MOR GOUVEIA,1807,NOSSA SENHORA DE NAZARE,NATAL,RN,BRAZIL"",-5.8236732,-35.2272305";;;
"NE,RN,NATAL,POSTOS CANAA LTDA,04.800.604/0001-73,AVENIDA DOUTOR JOAO MEDEIROS FILHO,900,ANTIGO 2761,POTENGI,59108-550,GASOLINA,27/04/2026,6.64,,R$ / litro,BRANCA,""AVENIDA DOUTOR JOAO MEDEIROS FILHO,900,POTENGI,NATAL,RN,BRAZIL"",-5.7678592,-35.2545913";;;
"N,RO,CACOAL,AUTO POSTO SOBERANO LTDA,07.219.464/0001-32,AVENIDA CASTELO BRANCO,21026,,NOVO HORIZONTE,76962-070,GASOLINA,27/04/2026,6.74,,R$ / litro,BRANCA,""AVENIDA CASTELO BRANCO,21026,NOVO HORIZONTE,CACOAL,RO,BRAZIL"",-11.4333702,-61.4633389";;;
"N,RO,PIMENTA BUENO,GAROTINHO COMÉRCIO DE COMBUSTÍVEIS - LTDA,04.010.130/0001-66,RUA ALCINDA RIBEIRO DE SOUZA,203,,CENTRO,78984-000,GASOLINA,27/04/2026,6.79,,R$ / litro,RAIZEN,""RUA ALCINDA RIBEIRO DE SOUZA,203,CENTRO,PIMENTA BUENO,RO,BRAZIL"",-11.6766467,-61.1864318";;;
"N,RO,PIMENTA BUENO,POSTO SIMONI LTDA,02.988.602/0001-24,AVENIDA MARECHAL RONDON,2245,,APIDIA,76970-000,GASOLINA,27/04/2026,6.79,,R$ / litro,VIBRA,""AVENIDA MARECHAL RONDON,2245,APIDIA,PIMENTA BUENO,RO,BRAZIL"",-11.6856992,-61.1836091";;;
"N,RO,PORTO VELHO,IRMAOS RUSSI LTDA,34.770.685/0003-39,AVENIDA NACOES UNIDAS,1608,,ROQUE,76804-436,GASOLINA,27/04/2026,6.66,,R$ / litro,VIBRA,""AVENIDA NACOES UNIDAS,1608,ROQUE,PORTO VELHO,RO,BRAZIL"",-8.7703439,-63.8839694";;;
"N,RO,PORTO VELHO,POSTO MAIA LTDA,02.745.235/0001-38,AVENIDA NAÇÕES UNIDAS,238,,NOSSA SENHORA DAS GRAÇAS,78915-040,GASOLINA,27/04/2026,6.79,,R$ / litro,VIBRA,""AVENIDA NAÇÕES UNIDAS,238,NOSSA SENHORA DAS GRAÇAS,PORTO VELHO,RO,BRAZIL"",-8.7648245,-63.8953466";;;
"N,RR,BOA VISTA,AUTO POSTO CINCO ESTRELAS LTDA,03.667.416/0001-56,RUA ANTONIO MACIEL,2047,,CAIMBE,69312-162,GASOLINA,27/04/2026,6.78,,R$ / litro,VIBRA,""RUA ANTONIO MACIEL,2047,CAIMBE,BOA VISTA,RR,BRAZIL"",2.823453,-60.714361";;;
"N,RR,BOA VISTA,A. P. FACCIO & CIA LTDA,03.611.874/0001-73,AVENIDA BRASIL,1228,QUADRA 74,CINTURAO VERDE,69312-450,GASOLINA,29/04/2026,6.59,,R$ / litro,IPIRANGA,""AVENIDA BRASIL,1228,CINTURAO VERDE,BOA VISTA,RR,BRAZIL"",2.7966187,-60.6988424";;;
"N,RR,BOA VISTA,J. PEREIRA DE JESUS & CIA LTDA,03.980.102/0001-09,RUA ADVOGADO MARCO ANTONIO DA SILVA PINHEIRO,56,,JARDIM TROPICAL,69314-580,GASOLINA,29/04/2026,6.05,,R$ / litro,RAIZEN,""RUA ADVOGADO MARCO ANTONIO DA SILVA PINHEIRO,56,JARDIM TROPICAL,BOA VISTA,RR,BRAZIL"",2.799012,-60.7258925";;;
"N,RR,BOA VISTA,RORAIPETRO RORAIMA PETROLEO LTDA,00.581.612/0001-15,RUA CECILIA BRASIL,969,,CENTRO,69301-080,GASOLINA,29/04/2026,6.05,,R$ / litro,BRANCA,""RUA CECILIA BRASIL,969,CENTRO,BOA VISTA,RR,BRAZIL"",2.8181702,-60.6756446";;;
"S,RS,ALVORADA,COMERCIAL DE COMBUSTIVEIS OTTEN LTDA,02.716.930/0001-71,AVENIDA PRESIDENTE GETULIO VARGAS,259,,BELA VISTA,94810-000,GASOLINA,29/04/2026,6.49,,R$ / litro,VIBRA,""AVENIDA PRESIDENTE GETULIO VARGAS,259,BELA VISTA,ALVORADA,RS,BRAZIL"",-30.0107559,-51.090695";;;
"S,RS,BAGE,GBI COMBUSTIVEIS LTDA.,90.589.698/0001-15,RUA GENERAL SAMPAIO,201,,CENTRO,96400-370,GASOLINA,29/04/2026,6.54,,R$ / litro,RAIZEN,""RUA GENERAL SAMPAIO,201,CENTRO,BAGE,RS,BRAZIL"",-31.3314725,-54.1022442";;;
"S,RS,CACHOEIRA DO SUL,COOP. DOS MOTORISTAS PROFIS. DE CACHOEIRA DO SUL LTDA,87.012.050/0001-77,RUA MIGUEL LORETO SOBRINHO,28,ESQUINA COM BR 153,DISTRITO INDUSTRIAL,96501-150,GASOLINA,28/04/2026,6.29,,R$ / litro,RAIZEN,""RUA MIGUEL LORETO SOBRINHO,28,DISTRITO INDUSTRIAL,CACHOEIRA DO SUL,RS,BRAZIL"",-30.0401956,-52.913786";;;
"S,RS,SAO LEOPOLDO,POSTOS DE COMBUSTIVEIS REDESINOS LTDA,01.731.418/0001-31,AVENIDA FEITORIA,4288,,FEITORIA,93048-000,GASOLINA,28/04/2026,6.29,,R$ / litro,BRANCA,""AVENIDA FEITORIA,4288,FEITORIA,SAO LEOPOLDO,RS,BRAZIL"",-29.7548657,-51.1010066";;;
"S,RS,CAXIAS DO SUL,POSTO RAMAR - COMERCIO DE COMBUSTIVEIS LTDA.,05.379.733/0001-00,AVENIDA SAO LEOPOLDO,940,,SAO LEOPOLDO,95097-350,GASOLINA,28/04/2026,6.28,,R$ / litro,ALE,""AVENIDA SAO LEOPOLDO,940,SAO LEOPOLDO,CAXIAS DO SUL,RS,BRAZIL"",-29.1845322,-51.186237";;;
"S,RS,CAXIAS DO SUL,POSTO DE SERVICO CAXIAS LTDA,88.632.823/0001-80,RUA PINHEIRO MACHADO,2270,TERREO,CENTRO,95020-172,GASOLINA,28/04/2026,6.29,,R$ / litro,VIBRA,""RUA PINHEIRO MACHADO,2270,CENTRO,CAXIAS DO SUL,RS,BRAZIL"",-29.1672465,-51.1843166";;;
"S,RS,LAJEADO,AUTO POSTO FASCINA LTDA.,08.724.271/0001-00,AVENIDA SENADOR ALBERTO PASQUALINI,1351,,SAO CRISTOVAO,95900-010,GASOLINA,27/04/2026,6.38,,R$ / litro,VIBRA,""AVENIDA SENADOR ALBERTO PASQUALINI,1351,SAO CRISTOVAO,LAJEADO,RS,BRAZIL"",-29.4496981,-51.9644959";;;
"S,RS,LAJEADO,COMERCIO DE COMBUSTIVEIS FLORESTAL LTDA,02.558.109/0001-74,AVENIDA BENJAMIN CONSTANT,1791,,FLORESTAL,95900-700,GASOLINA,27/04/2026,6.29,,R$ / litro,VIBRA,""AVENIDA BENJAMIN CONSTANT,1791,FLORESTAL,LAJEADO,RS,BRAZIL"",-29.4572292,-51.972631";;;
"S,RS,NOVO HAMBURGO,DA COMERCIO DE COMBUSTIVEIS E LUBRIFICANTES LTDA,07.779.562/0001-24,AVENIDA GENERAL DALTRO FILHO,494,,HAMBURGO VELHO,93534-034,GASOLINA,30/04/2026,6.63,,R$ / litro,BRANCA,""AVENIDA GENERAL DALTRO FILHO,494,HAMBURGO VELHO,NOVO HAMBURGO,RS,BRAZIL"",-29.6730346,-51.1135061";;;
"S,RS,NOVO HAMBURGO,AUTO POSTO IDEAL LTDA,88.720.560/0001-61,AVENIDA SETE DE SETEMBRO,274,,LIBERDADE,93332-470,GASOLINA,29/04/2026,6.19,,R$ / litro,VIBRA,""AVENIDA SETE DE SETEMBRO,274,LIBERDADE,NOVO HAMBURGO,RS,BRAZIL"",-29.7128039,-51.1445323";;;
"S,RS,PELOTAS,""H.LANG FILHO COMERCIO,REPRESENTACOES E TRANSPORTES LTDA"",91.010.082/0001-00,AVENIDA ADOLFO FETTER,3300,,LARANJAL,96083-000,GASOLINA,28/04/2026,6.39,,R$ / litro,VIBRA,""AVENIDA ADOLFO FETTER,3300,LARANJAL,PELOTAS,RS,BRAZIL"",-31.7595758,-52.2514847";;;
"S,RS,SANTA CRUZ DO SUL,POSTO SHOPPING CAR COMBUSTIVEIS LTDA.,00.121.811/0001-40,RODOVIA BR 471,S/N,KM    56,VILA SCHULZ,96845-545,GASOLINA,29/04/2026,6.29,,R$ / litro,VIBRA,""RODOVIA BR 471,S/N,VILA SCHULZ,SANTA CRUZ DO SUL,RS,BRAZIL"",-31.2658759,-52.7936711";;;
"S,RS,SANTA CRUZ DO SUL,COMERCIO DE COMBUSTIVEIS NEVOEIRO LTDA,95.425.369/0001-52,RUA SENADOR PINHEIRO MACHADO,748,,CENTRO,96810-136,GASOLINA,28/04/2026,6.41,,R$ / litro,IPIRANGA,""RUA SENADOR PINHEIRO MACHADO,748,CENTRO,SANTA CRUZ DO SUL,RS,BRAZIL"",-29.7216677,-52.4294981";;;
"S,RS,SANTA MARIA,H. D. PORTELLA & CIA LTDA,07.663.077/0001-90,AVENIDA FERNANDO FERRARI,1255,,NOSSA SRA DE LOURDES,97050-801,GASOLINA,28/04/2026,6.39,,R$ / litro,ALE,""AVENIDA FERNANDO FERRARI,1255,NOSSA SRA DE LOURDES,SANTA MARIA,RS,BRAZIL"",-29.6958868,-53.7987236";;;
"S,RS,SANTA ROSA,COOPERATIVA MISTA SAO LUIZ LTDA,98.338.072/0041-35,AVENIDA INHACORA,673,,CENTRO,98780-818,GASOLINA,28/04/2026,6.39,,R$ / litro,BRANCA,""AVENIDA INHACORA,673,CENTRO,SANTA ROSA,RS,BRAZIL"",-27.8637158,-54.4834958";;;
"S,RS,SANTA ROSA,POSTO DE COMBUSTIVEIS VACCARI LTDA,87.687.489/0001-08,AVENIDA RIO BRANCO,26,,CENTRO,98780-702,GASOLINA,27/04/2026,6.38,,R$ / litro,RAIZEN,""AVENIDA RIO BRANCO,26,CENTRO,SANTA ROSA,RS,BRAZIL"",-27.8652057,-54.4746999";;;
"S,RS,SANTANA DO LIVRAMENTO,JOSÉ CARAFINI & FILHOS LTDA,07.179.657/0001-07,AVENIDA ALMIRANTE TAMANDARÉ,582,,CENTRO,97574-210,GASOLINA,28/04/2026,6.49,,R$ / litro,VIBRA,""AVENIDA ALMIRANTE TAMANDARÉ,582,CENTRO,SANTANA DO LIVRAMENTO,RS,BRAZIL"",-30.8929682,-55.5388673";;;
"S,RS,SANTO ANGELO,COMERCIO DE COMBUSTIVEIS HANKE LTDA,94.616.117/0001-48,RUA ANTONIO MANOEL,1407,,CENTRO,98801-690,GASOLINA,27/04/2026,6.59,,R$ / litro,IPIRANGA,""RUA ANTONIO MANOEL,1407,CENTRO,SANTO ANGELO,RS,BRAZIL"",-28.3052335,-54.2561308";;;
"S,RS,SAO LEOPOLDO,ARGOS COMERCIAL DE COMBUSTIVEIS LTDA,00.959.052/0001-90,AVENIDA CAXIAS DO SUL,950,,RIO DOS SINOS,93110-000,GASOLINA,27/04/2026,6.44,,R$ / litro,ALE,""AVENIDA CAXIAS DO SUL,950,RIO DOS SINOS,SAO LEOPOLDO,RS,BRAZIL"",-29.750632,-51.150977";;;
"S,RS,SAPIRANGA,POSTO ROTA 239 ABASTECEDORA DE COMBUSTIVEIS E SERVICOS LTDA,04.060.196/0001-60,RUA SETE DE SETEMBRO,842,,CENTRO,93800-122,GASOLINA,27/04/2026,6.07,,R$ / litro,IPIRANGA,""RUA SETE DE SETEMBRO,842,CENTRO,SAPIRANGA,RS,BRAZIL"",-29.6440524,-51.0068657";;;
"S,RS,URUGUAIANA,AUTO SERVICOS PRIMAR COMERCIO DE COMBUSTIVEIS LTDA,09.261.304/0001-87,AVENIDA PRESIDENTE VARGAS,4590,,BOA VISTA,97510-430,GASOLINA,27/04/2026,6.5,,R$ / litro,VIBRA,""AVENIDA PRESIDENTE VARGAS,4590,BOA VISTA,URUGUAIANA,RS,BRAZIL"",-29.7585727,-57.086655";;;
"S,RS,VACARIA,COMERCIO DE COMBUSTIVEIS POLLY POSITION LTDA,08.051.756/0001-71,AVENIDA PRESIDENTE JUCELINO KUBITSCHEK DE OLIVEIRA,8669,,JARDIM DOS PAMPAS,95207-000,GASOLINA,28/04/2026,6.39,,R$ / litro,IPIRANGA,""AVENIDA PRESIDENTE JUCELINO KUBITSCHEK DE OLIVEIRA,8669,JARDIM DOS PAMPAS,VACARIA,RS,BRAZIL"",-28.5070668,-50.9265897";;;
"S,RS,VACARIA,PG COMERCIO E TRANSPORTES DE COMBUSTIVEIS LTDA,88.645.635/0001-97,AVENIDA MILITAR,2525,,GLORIA,95216-014,GASOLINA,28/04/2026,6.58,,R$ / litro,RAIZEN,""AVENIDA MILITAR,2525,GLORIA,VACARIA,RS,BRAZIL"",-28.5000538,-50.9503047";;;
"S,SC,BLUMENAU,AUTO POSTO BLU LIMITADA,07.134.578/0001-80,RUA SETE DE SETEMBRO,2093,FRENTE,CENTRO,89012-401,GASOLINA,29/04/2026,6.29,,R$ / litro,BRANCA,""RUA SETE DE SETEMBRO,2093,CENTRO,BLUMENAU,SC,BRAZIL"",-26.9148646,-49.0745859";;;
"S,SC,BLUMENAU,POSTO FORTALEZA LTDA,02.770.836/0001-09,RUA PRINCIPAL FRANCISCO VAHLDIECK,3635,,FORTALEZA ALTA,89058-000,GASOLINA,29/04/2026,6.29,,R$ / litro,BRANCA,""RUA PRINCIPAL FRANCISCO VAHLDIECK,3635,FORTALEZA ALTA,BLUMENAU,SC,BRAZIL"",-26.8610801,-49.0503857";;;
"S,SC,BLUMENAU,POSTO Z18 LTDA,02.858.142/0001-10,RUA DOUTOR PEDRO ZIMMERMANN,1831,,ITOUPAVAZINHA,89066-001,GASOLINA,29/04/2026,6.89,,R$ / litro,IPIRANGA,""RUA DOUTOR PEDRO ZIMMERMANN,1831,ITOUPAVAZINHA,BLUMENAU,SC,BRAZIL"",-26.8594044,-49.0864877";;;
"S,SC,BLUMENAU,POSTO ZIMMER LTDA,01.886.370/0001-30,RUA ALMIRANTE TAMANDARE,888,ESQ TOBIAS,VILA NOVA,89035-000,GASOLINA,29/04/2026,6.69,,R$ / litro,IPIRANGA,""RUA ALMIRANTE TAMANDARE,888,VILA NOVA,BLUMENAU,SC,BRAZIL"",-26.911212,-49.0897414";;;
"S,SC,BRUSQUE,AUTO POSTO R&R SANTA TEREZINHA LTDA,04.890.720/0001-20,RUA DORVAL LUZ,115,,SANTA TEREZINHA,88352-401,GASOLINA,29/04/2026,6.49,,R$ / litro,BRANCA,""RUA DORVAL LUZ,115,SANTA TEREZINHA,BRUSQUE,SC,BRAZIL"",-27.0694819,-48.8837284";;;
"S,SC,CONCORDIA,AUTO POSTO CONTORNO LTDA,07.605.062/0001-76,RODOVIA CAETANO CHIUCHETTA,6601,,CONTORNO NORTE,89700-001,GASOLINA,29/04/2026,6.49,,R$ / litro,BRANCA,""RODOVIA CAETANO CHIUCHETTA,6601,CONTORNO NORTE,CONCORDIA,SC,BRAZIL"",-27.2032804,-52.0299299";;;
"S,SC,CONCORDIA,ABASTECEDORA DE COMBUSTIVEIS SANTA CLARA LTDA,02.331.925/0001-40,""RUA MARCELINO RAMOS,"",10,ESQ.C/R-29 DE JULHO,CENTRO,89700-001,GASOLINA,29/04/2026,6.49,,R$ / litro,BRANCA,""RUA MARCELINO RAMOS,,10,CENTRO,CONCORDIA,SC,BRAZIL"",-27.2358311,-52.0318595";;;
"S,SC,CRICIUMA,COMERCIO DE COMBUSTIVEIS PINHEIRAO EIRELI,06.935.003/0001-01,RUA CONEGO ANIBAL MARIA DI FRANCIA,1075,SALA  01,PINHEIRINHO,88804-360,GASOLINA,28/04/2026,6.57,,R$ / litro,BRANCA,""RUA CONEGO ANIBAL MARIA DI FRANCIA,1075,PINHEIRINHO,CRICIUMA,SC,BRAZIL"",-28.6951859,-49.395744";;;
"S,SC,CRICIUMA,AUTO POSTO DARIO LTDA,83.262.006/0001-64,AVENIDA CENTENARIO,6,,PROSPERA,88815-000,GASOLINA,29/04/2026,6.59,,R$ / litro,IPIRANGA,""AVENIDA CENTENARIO,6,PROSPERA,CRICIUMA,SC,BRAZIL"",-28.6792889,-49.3487069";;;
"S,SC,CRICIUMA,AUTO POSTO PINHEIRO LTDA,82.549.809/0001-31,RUA DESEMBARGADOR PEDRO SILVA,355,,COMERCIARIO,88802-300,GASOLINA,28/04/2026,6.49,,R$ / litro,BRANCA,""RUA DESEMBARGADOR PEDRO SILVA,355,COMERCIARIO,CRICIUMA,SC,BRAZIL"",-28.6836991,-49.3688307";;;
"S,SC,CRICIUMA,COMERCIAL DE COMBUSTIVEIS ROSSO LTDA,78.885.019/0001-50,AVENIDA CENTENARIO,1717,,SANTO ANTONIO,88809-000,GASOLINA,29/04/2026,6.79,,R$ / litro,RAIZEN,""AVENIDA CENTENARIO,1717,SANTO ANTONIO,CRICIUMA,SC,BRAZIL"",-28.6809399,-49.3642742";;;
"S,SC,BRUSQUE,POSTO MIME S.A.,83.488.882/0006-18,AVENIDA LAURO MULLER,149,,CENTRO,88353-040,GASOLINA,28/04/2026,6.59,,R$ / litro,IPIRANGA,""AVENIDA LAURO MULLER,149,CENTRO,BRUSQUE,SC,BRAZIL"",-27.1033646,-48.9154887";;;
"S,SC,TUBARAO,ESTACAO PREMIER COMERCIO DE COMBUSTIVEIS LTDA,01.354.648/0001-29,RUA SAO GERALDO,385,,OFICINAS,88701-020,GASOLINA,29/04/2026,6.69,,R$ / litro,VIBRA,""RUA SAO GERALDO,385,OFICINAS,TUBARAO,SC,BRAZIL"",-28.4886509,-49.0164488";;;
"NE,SE,ARACAJU,GAMA E CIA LTDA,13.007.752/0002-07,AVENIDA AUGUSTO FRANCO,2990,,PONTO NOVO,49047-040,GASOLINA,28/04/2026,6.59,,R$ / litro,IPIRANGA,""AVENIDA AUGUSTO FRANCO,2990,PONTO NOVO,ARACAJU,SE,BRAZIL"",-10.930422,-37.0740535";;;
"NE,SE,ARACAJU,LIDER COMERCIO DE COMBUSTIVEIS LTDA,15.591.357/0001-69,PRACA DA BANDEIRA,171,,CENTRO,49055-090,GASOLINA,27/04/2026,6.45,,R$ / litro,ALE,""PRACA DA BANDEIRA,171,CENTRO,ARACAJU,SE,BRAZIL"",-10.9182423,-37.0578299";;;
"NE,SE,ARACAJU,LUBRIFICANTES E ACESSÓRIOS LTDA.,13.257.050/0001-09,AVENIDA BEIRA MAR,6,,13 DE JULHO,49020-010,GASOLINA,27/04/2026,6.47,,R$ / litro,ALE,""AVENIDA BEIRA MAR,6,13 DE JULHO,ARACAJU,SE,BRAZIL"",-10.9252531,-37.0443592";;;
"NE,SE,ARACAJU,J. L. OLIVEIRA & BARROS LTDA,13.113.477/0004-78,AVENIDA GENTIL TAVARES,381,CASA,GETULIO VARGAS,49055-670,GASOLINA,27/04/2026,6.49,,R$ / litro,RAIZEN,""AVENIDA GENTIL TAVARES,381,GETULIO VARGAS,ARACAJU,SE,BRAZIL"",-10.9093814,-37.0629611";;;
"NE,SE,ARACAJU,AMARAL & CIA LTDA,13.008.610/0001-83,RUA MARIANO SALMERON,709,,SIQUEIRA CAMPOS,49075-370,GASOLINA,30/04/2026,6.59,,R$ / litro,VIBRA,""RUA MARIANO SALMERON,709,SIQUEIRA CAMPOS,ARACAJU,SE,BRAZIL"",-10.910836,-37.0737335";;;
"NE,SE,LAGARTO,POSTO J MACARIO LTDA,01.243.118/0001-03,AVENIDA PRESIDENTE VARGAS,350,,CENTRO,49400-000,GASOLINA,30/04/2026,6.49,,R$ / litro,IPIRANGA,""AVENIDA PRESIDENTE VARGAS,350,CENTRO,LAGARTO,SE,BRAZIL"",-10.9190225,-37.674153";;;
"SE,SP,ADAMANTINA,AUTO POSTO CARREIRO LTDA,55.451.876/0001-46,AVENIDA CAP JOSE A DE OLIVEIRA,160,,CENTRO,17800-000,GASOLINA,30/04/2026,6.59,,R$ / litro,IPIRANGA,""AVENIDA CAP JOSE A DE OLIVEIRA,160,CENTRO,ADAMANTINA,SP,BRAZIL"",-21.6911621,-51.0732328";;;
"SE,SP,ADAMANTINA,MARCIO A SPOSITO TRANSPORTES LTDA,54.187.588/0002-44,AVENIDA RIO BRANCO,1625,,VILA INDUSTRIAL,17800-000,GASOLINA,27/04/2026,6.19,,R$ / litro,ALE,""AVENIDA RIO BRANCO,1625,VILA INDUSTRIAL,ADAMANTINA,SP,BRAZIL"",-21.6762498,-51.0788822";;;
"SE,SP,ARARAQUARA,AUTO POSTO CEAEME LTDA.,07.532.598/0001-09,AVENIDA PRESIDENTE VARGAS,2750,,QUITANDINHA,14801-000,GASOLINA,27/04/2026,6.05,,R$ / litro,BRANCA,""AVENIDA PRESIDENTE VARGAS,2750,QUITANDINHA,ARARAQUARA,SP,BRAZIL"",-21.8036674,-48.1976557";;;
"SE,SP,ARARAQUARA,CAMPOS & FERNANDEZ LTDA,03.776.999/0001-53,RUA MAURICIO GALLI,4245,,JD.ROBERTO SELMI DEI,14806-245,GASOLINA,28/04/2026,6.29,,R$ / litro,VIBRA,""RUA MAURICIO GALLI,4245,JD.ROBERTO SELMI DEI,ARARAQUARA,SP,BRAZIL"",-21.7405756,-48.1516239";;;
"SE,SP,ARARAQUARA,AUTO POSTO PODIUM LTDA,02.975.066/0001-22,AVENIDA MANUEL DE ABREU,4205,,CHACARA VELOSA,14806-545,GASOLINA,27/04/2026,6.15,,R$ / litro,BRANCA,""AVENIDA MANUEL DE ABREU,4205,CHACARA VELOSA,ARARAQUARA,SP,BRAZIL"",-21.7482182,-48.1350442";;;
"SE,SP,ARARAQUARA,REYSSOL COMERCIO E SERVIÇOS LTDA,00.218.960/0001-22,AVENIDA PADRE FRANCISCO COLTURATO,22,,JARDIM PRIMAVERA,14802-000,GASOLINA,27/04/2026,6.19,,R$ / litro,VIBRA,""AVENIDA PADRE FRANCISCO COLTURATO,22,JARDIM PRIMAVERA,ARARAQUARA,SP,BRAZIL"",-21.7792023,-48.179788";;;
"SE,SP,ATIBAIA,LUCAS AUTO POSTO LTDA,02.243.652/0001-82,ALAMEDA PROF LUCAS N.GARCES,3816,,VL ESPERIA,12953-162,GASOLINA,27/04/2026,6.29,,R$ / litro,RAIZEN,""ALAMEDA PROF LUCAS N.GARCES,3816,VL ESPERIA,ATIBAIA,SP,BRAZIL"",-23.140022,-46.55471";;;
"SE,SP,ATIBAIA,SERV POSTO PERFIL LTDA,02.413.786/0001-02,AVENIDA PROFESSOR CARLOS ALBERTO DE CARVALHO PINTO,753,,ALVINOPOLIS,12942-530,GASOLINA,28/04/2026,6.25,,R$ / litro,ALE,""AVENIDA PROFESSOR CARLOS ALBERTO DE CARVALHO PINTO,753,ALVINOPOLIS,ATIBAIA,SP,BRAZIL"",-23.1169808,-46.5681097";;;
"SE,SP,ATIBAIA,ARAUJO AUTO POSTO E SERVICOS LTDA,01.637.558/0001-45,AVENIDA PROFESSOR FLAVIO PIRES DE CAMARGO,1025,,CAETETUBA,12951-750,GASOLINA,27/04/2026,6.29,,R$ / litro,VIBRA,""AVENIDA PROFESSOR FLAVIO PIRES DE CAMARGO,1025,CAETETUBA,ATIBAIA,SP,BRAZIL"",-23.1168354,-46.5823792";;;
"SE,SP,BAURU,AUTO POSTO PETRO NACOES BAURU LTDA,04.534.449/0001-90,AVENIDA NACOES UNIDAS,17-50,,CENTRO,17053-460,GASOLINA,28/04/2026,6.29,,R$ / litro,VIBRA,""AVENIDA NACOES UNIDAS,17-50,CENTRO,BAURU,SP,BRAZIL"",-22.3261659,-49.0634813";;;
"SE,SP,BAURU,POSTO DE COMBUSTIVEIS TOP CASTELO LTDA,03.139.223/0001-22,""AVENIDA CASTELO BRANCO,"",19-20,,VILA PAULISTA,17052-000,GASOLINA,27/04/2026,6.19,,R$ / litro,BRANCA,""AVENIDA CASTELO BRANCO,,19-20,VILA PAULISTA,BAURU,SP,BRAZIL"",-22.3445326,-49.0958632";;;
"SE,SP,BAURU,AUTO POSTO DUQUE 21 DE MOURA LTDA,02.769.811/0001-87,AVENIDA DUQUE DE CAXIAS,21-30,,JARDIM HIGIENOPOLIS,17044-140,GASOLINA,27/04/2026,6.1,,R$ / litro,BRANCA,""AVENIDA DUQUE DE CAXIAS,21-30,JARDIM HIGIENOPOLIS,BAURU,SP,BRAZIL"",-22.3254267,-49.0540704";;;
"SE,SP,BAURU,REDE LK DE POSTOS LTDA,01.820.806/0009-46,RUA EZEQUIEL RAMOS,46042,,CENTRO,17010-021,GASOLINA,27/04/2026,6.17,,R$ / litro,VIBRA,""RUA EZEQUIEL RAMOS,46042,CENTRO,BAURU,SP,BRAZIL"",-22.319166,-49.0662948";;;
"SE,SP,BAURU,COMERCIO DERIVADOS DE PETROLEO RODOVIARIO DE BAURU LTDA,01.332.585/0001-00,AVENIDA NUNO DE ASSIS,46337,-,JARDIM BELA VISTA,17053-460,GASOLINA,30/04/2026,6.29,,R$ / litro,ALE,""AVENIDA NUNO DE ASSIS,46337,JARDIM BELA VISTA,BAURU,SP,BRAZIL"",-22.3113443,-49.0642029";;;
"SE,SP,BAURU,POSTO NOSSA SENHORA DE FATIMA BAURU LTDA,00.021.475/0001-64,RUA BERNARDINO DE CAMPOS,28307,,VILA FALCAO,17050-040,GASOLINA,30/04/2026,6.39,,R$ / litro,RAIZEN,""RUA BERNARDINO DE CAMPOS,28307,VILA FALCAO,BAURU,SP,BRAZIL"",-22.3361007,-49.0997852";;;
"SE,SP,CACAPAVA,AUTO POSTO SIQUEIRA SALOMÃO LTDA.,09.007.668/0001-35,AVENIDA DR. JOSÉ DE MOURA RESENDE,570,,VERA CRUZ,12287-650,GASOLINA,27/04/2026,6.57,,R$ / litro,BRANCA,""AVENIDA DR. JOSÉ DE MOURA RESENDE,570,VERA CRUZ,CACAPAVA,SP,BRAZIL"",-23.1040945,-45.7154825";;;
"SE,SP,CACAPAVA,ECO POSTO DE COMBUSTIVEIS PANTERA DOURADA LTDA,04.657.542/0001-92,RODOVIA JOAO AMARAL GURGEL,2,,PIEDADE,12285-020,GASOLINA,27/04/2026,6.59,,R$ / litro,IPIRANGA,""RODOVIA JOAO AMARAL GURGEL,2,PIEDADE,CACAPAVA,SP,BRAZIL"",-23.122894,-45.7122639";;;
"SE,SP,CARAGUATATUBA,AUTO POSTO PRAIA DA FLECHEIRA LTDA,07.679.108/0001-00,AVENIDA GASPAR DE SOUZA,450,,PRAIA DAS PALMEIRAS,11666-250,GASOLINA,27/04/2026,6.59,,R$ / litro,VIBRA,""AVENIDA GASPAR DE SOUZA,450,PRAIA DAS PALMEIRAS,CARAGUATATUBA,SP,BRAZIL"",-23.6657644,-45.4354757";;;
"SE,SP,CARAGUATATUBA,AUTO POSTO PRAIA CENTER LTDA,03.255.192/0001-75,AVENIDA DR. ARTHUR COSTA FILHO,841,,CENTRO,11660-490,GASOLINA,27/04/2026,6.59,,R$ / litro,VIBRA,""AVENIDA DR. ARTHUR COSTA FILHO,841,CENTRO,CARAGUATATUBA,SP,BRAZIL"",-23.6244958,-45.4111513";;;
"SE,SP,CATANDUVA,ALEXANDRE FELIPE FRANCA,06.068.988/0001-07,RUA AURORA DO NORTE,561,,PARQUE FLAMINGO,15803-235,GASOLINA,27/04/2026,6.59,,R$ / litro,RAIZEN,""RUA AURORA DO NORTE,561,PARQUE FLAMINGO,CATANDUVA,SP,BRAZIL"",-21.1279891,-48.9928585";;;
"SE,SP,CATANDUVA,AUTO POSTO PARQUE IRACEMA DE CATANDUVA LTDA,55.835.326/0001-20,AVENIDA SAO VICENTE DE PAULO,581,,JARDIM BELA VISTA,15809-055,GASOLINA,27/04/2026,6.59,,R$ / litro,IPIRANGA,""AVENIDA SAO VICENTE DE PAULO,581,JARDIM BELA VISTA,CATANDUVA,SP,BRAZIL"",-21.1456478,-48.9657384";;;
"SE,SP,VOTUPORANGA,AUTO POSTO SERTANEJO DE VOTUPORANGA LTDA,03.604.561/0001-98,RODOVIA EUCLIDES DA CUNHA,S/N,KM    507,ZONA RURAL,15500-001,GASOLINA,27/04/2026,6.69,,R$ / litro,BRANCA,""RODOVIA EUCLIDES DA CUNHA,S/N,ZONA RURAL,VOTUPORANGA,SP,BRAZIL"",-20.3986127,-49.9950339";;;
,,,,,,,,,,,,,,,,,,;;;
"SE,SP,COTIA,AUTO POSTO D+ II LTDA,03.719.885/0001-71,ESTRADA FERNANDO NOBRE,749,,PARQUE RINCAO,06705-490,GASOLINA,27/04/2026,6.59,,R$ / litro,IPIRANGA,""ESTRADA FERNANDO NOBRE,749,PARQUE RINCAO,COTIA,SP,BRAZIL"",-23.5896268,-46.8812408";;;
,,,,,,,,,,,,,,,,,,;;;
"SE,SP,COTIA,AUTO POSTO CARANDA LTDA,03.046.576/0001-88,RUA PAULO JACINTO,31,,JARDIM SAO VICENTE,06713-180,GASOLINA,27/04/2026,7.29,,R$ / litro,VIBRA,""RUA PAULO JACINTO,31,JARDIM SAO VICENTE,COTIA,SP,BRAZIL"",-23.6015382,-46.8575707";;;
,,,,,,,,,,,,,,,,,,;;;
"SE,SP,COTIA,LEMA AUTO POSTO LTDA,03.447.645/0001-65,AVENIDA PROFESSOR MANOEL JOSE PEDROSO,1246,,CIDADE DAS ROSAS,06717-100,GASOLINA,27/04/2026,6.59,,R$ / litro,RAIZEN,""AVENIDA PROFESSOR MANOEL JOSE PEDROSO,1246,CIDADE DAS ROSAS,COTIA,SP,BRAZIL"",-23.6075748,-46.9165654";;;
,,,,,,,,,,,,,,,,,,;;;
,,,,,,,,,,,,,,,,,,;;;
"SE,SP,COTIA,AUTO POSTO ROTA 66 LTDA,00.653.292/0001-61,AVENIDA ROQUE CELESTINO PIRES,959,,CAUCAIA DO ALTO,06727-185,GASOLINA,27/04/2026,6.55,,R$ / litro,VIBRA,""AVENIDA ROQUE CELESTINO PIRES,959,CAUCAIA DO ALTO,COTIA,SP,BRAZIL"",-23.6854025,-47.0210937";;;
,,,,,,,,,,,,,,,,,,;;;
,,,,,,,,,,,,,,,,,,;;;
"SE,SP,CRUZEIRO,AUTO POSTO VILA RICA - SAO CRISTOVAO LTDA,03.219.617/0001-90,AVENIDA MINAS GERAIS,1,,II RET. MANTIQUEIRA,12712-010,GASOLINA,27/04/2026,6.59,,R$ / litro,BRANCA,""AVENIDA MINAS GERAIS,1,II RET. MANTIQUEIRA,CRUZEIRO,SP,BRAZIL"",-22.5775394,-44.9600807";;;
,,,,,,,,,,,,,,,,,,;;;
,,,,,,,,,,,,,,,,,,;;;
"SE,SP,CRUZEIRO,POSTO TUPY LTDA,45.198.199/0001-42,RUA CEL JOSE DE CASTRO,790,,CENTRO,12701-450,GASOLINA,27/04/2026,6.59,,R$ / litro,VIBRA,""RUA CEL JOSE DE CASTRO,790,CENTRO,CRUZEIRO,SP,BRAZIL"",-22.5758614,-44.959734";;;
,,,,,,,,,,,,,,,,,,;;;
,,,,,,,,,,,,,,,,,,;;;
"SE,SP,CUBATAO,AUTO POSTO MATHIAS LTDA,47.489.273/0001-05,AVENIDA JOAQUIM MIGUEL COUTO,619,,VILA COUTO,11510-010,GASOLINA,30/04/2026,5.98,,R$ / litro,BRANCA,""AVENIDA JOAQUIM MIGUEL COUTO,619,VILA COUTO,CUBATAO,SP,BRAZIL"",-23.8848522,-46.4218115";;;
,,,,,,,,,,,,,,,,,,;;;
"SE,SP,DIADEMA,ZOOCAR AUTO POSTO LTDA,08.651.289/0001-10,AVENIDA AGUA FUNDA,913,,VILA SANTA LUZIA,09930-360,GASOLINA,30/04/2026,6.09,,R$ / litro,RAIZEN,""AVENIDA AGUA FUNDA,913,VILA SANTA LUZIA,DIADEMA,SP,BRAZIL"",-23.6626059,-46.6146607";;;
,,,,,,,,,,,,,,,,,,;;;
,,,,,,,,,,,,,,,,,,;;;
"SE,SP,DIADEMA,AUTO POSTO MIKE LTDA EM RECUPERACAO JUDICIAL,03.238.158/0001-92,AVENIDA ANTONIO PIRANGA,779,,CENTRO,09911-160,GASOLINA,30/04/2026,5.98,,R$ / litro,BRANCA,""AVENIDA ANTONIO PIRANGA,779,CENTRO,DIADEMA,SP,BRAZIL"",-23.6856409,-46.6165899";;;
,,,,,,,,,,,,,,,,,,;;;
"SE,SP,EMBU DAS ARTES,POSTO URSA MENOR LTDA,02.086.208/0001-09,AVENIDA ROTARY,2991,,PARQUE LUIZA,06816-100,GASOLINA,28/04/2026,6.47,,R$ / litro,TAURUS,""AVENIDA ROTARY,2991,PARQUE LUIZA,EMBU DAS ARTES,SP,BRAZIL"",-23.6468967,-46.8138577";;;
,,,,,,,,,,,,,,,,,,;;;
,,,,,,,,,,,,,,,,,,;;;
"SE,SP,EMBU DAS ARTES,AUTO POSTO JOAQUIN'S LTDA,01.883.203/0001-36,AVENIDA ELIAS YAZBEK,719,,TINGIDOR,06803-002,GASOLINA,28/04/2026,6.39,,R$ / litro,IPIRANGA,""AVENIDA ELIAS YAZBEK,719,TINGIDOR,EMBU DAS ARTES,SP,BRAZIL"",-23.6564383,-46.8520191";;;
,,,,,,,,,,,,,,,,,,;;;
,,,,,,,,,,,,,,,,,,;;;
"SE,SP,GUARATINGUETA,AUTO POSTO PONTE METÁLICA LTDA.,06.303.970/0001-42,PRACA MARTINS AFONSO,78,,CENTRO,12500-090,GASOLINA,28/04/2026,6.26,,R$ / litro,BRANCA,""PRACA MARTINS AFONSO,78,CENTRO,GUARATINGUETA,SP,BRAZIL"",-22.8123202,-45.1938926";;;
,,,,,,,,,,,,,,,,,,;;;
"SE,SP,GUARATINGUETA,CÂMARA EMPREENDIMENTOS COMERCIAIS LTDA.,04.802.471/0001-74,RUA MANOEL ANGELO DA SILVA,451,,BEIRA RIO 01,12517-610,GASOLINA,28/04/2026,6.49,,R$ / litro,BRANCA,""RUA MANOEL ANGELO DA SILVA,451,BEIRA RIO 01,GUARATINGUETA,SP,BRAZIL"",-22.7932339,-45.1859444";;;
,,,,,,,,,,,,,,,,,,;;;
,,,,,,,,,,,,,,,,,,;;;
"SE,SP,GUARULHOS,AUTO POSTO S. VICTOR LTDA.,07.334.890/0001-17,AVENIDA ARACAJU,180,,JD STA RITA,07143-220,GASOLINA,27/04/2026,6.38,,R$ / litro,VIBRA,""AVENIDA ARACAJU,180,JD STA RITA,GUARULHOS,SP,BRAZIL"",-23.4256713,-46.5022371";;;
,,,,,,,,,,,,,,,,,,;;;
"SE,SP,GUARULHOS,GRAN CUMBICA AUTO POSTO LTDA,08.606.671/0001-02,RUA AMELIA RODRIGUES,31,,JARDIM PRESIDENTE DUTRA,07172-150,GASOLINA,28/04/2026,6.49,,R$ / litro,IPIRANGA,""RUA AMELIA RODRIGUES,31,JARDIM PRESIDENTE DUTRA,GUARULHOS,SP,BRAZIL"",-23.4258142,-46.4326916";;;
,,,,,,,,,,,,,,,,,,;;;
,,,,,,,,,,,,,,,,,,;;;
"SE,SP,GUARULHOS,CENTRO AUTOMOTIVO TREVO DE BONSUCESSO LTDA,05.558.548/0001-75,AVENIDA PASCHOAL THOMEU,10,,VILA NOVA BONSUCESSO,07175-090,GASOLINA,28/04/2026,6.49,,R$ / litro,VIBRA,""AVENIDA PASCHOAL THOMEU,10,VILA NOVA BONSUCESSO,GUARULHOS,SP,BRAZIL"",-23.4257278,-46.4076463";;;
,,,,,,,,,,,,,,,,,,;;;
"SE,SP,GUARULHOS,COCAIA COMERCIO DE LUBRIFICANTES LTDA,07.558.287/0001-19,AVENIDA BRIGADEIRO FARIA LIMA,941,,COCAIA,07130-000,GASOLINA,28/04/2026,6.28,,R$ / litro,BRANCA,""AVENIDA BRIGADEIRO FARIA LIMA,941,COCAIA,GUARULHOS,SP,BRAZIL"",-23.4467348,-46.5213202";;;
,,,,,,,,,,,,,,,,,,;;;
,,,,,,,,,,,,,,,,,,;;;
"SE,SP,GUARULHOS,AUTO POSTO VENTUROSA LTDA.,07.390.143/0001-04,RUA PORTO VELHO,4,JARDIM CUMBICA,GUARULHOS,07240-060,GASOLINA,28/04/2026,6.54,,R$ / litro,VIBRA,""RUA PORTO VELHO,4,GUARULHOS,GUARULHOS,SP,BRAZIL"",-23.4426341,-46.4367051";;;
,,,,,,,,,,,,,,,,,,;;;
,,,,,,,,,,,,,,,,,,;;;
"SE,SP,GUARULHOS,POSTO DE SERVICO ARMANDO DE MORAES LTDA,06.293.329/0001-74,AVENIDA TIRADENTES,21,,JD. SANTA FRANCISCA,07090-000,GASOLINA,28/04/2026,6.35,,R$ / litro,VIBRA,""AVENIDA TIRADENTES,21,JD. SANTA FRANCISCA,GUARULHOS,SP,BRAZIL"",-23.4716932,-46.5336388";;;
,,,,,,,,,,,,,,,,,,;;;
,,,,,,,,,,,,,,,,,,;;;
"SE,SP,GUARULHOS,CENTRO AUTOMOTIVO LUIZ XII LTDA,05.794.555/0001-76,AVENIDA SALGADO FILHO,2,,JD SANTA MENA,07115-000,GASOLINA,28/04/2026,6.39,,R$ / litro,VIBRA,""AVENIDA SALGADO FILHO,2,JD SANTA MENA,GUARULHOS,SP,BRAZIL"",-23.4646811,-46.5296641";;;
,,,,,,,,,,,,,,,,,,;;;
,,,,,,,,,,,,,,,,,,;;;
